index,id,article_title,article_language,journal_title,journal_abbreviation,journal_issn,article_jvolumn,article_jissue,article_jcreated_at,article_pagination,author_list
491,179093,Persistence of profenophos and quinolphos on cultivated cucumber and its removal,0,empty,empty,0,1,0,1/14/01,917-920,"{""B. Vijayalakshmi""""D. Siva Rama Prasad""""D. Raveendranath""""K. Sri Rama Murthy""""A. Harinatha Reddy""}"
492,539034,Cognitive impairment and risk of cardiovascular events and mortality.,0,European heart journal,Eur. Heart J.,1522-9645,33,14,1/12/07,1777-86,"{""Salim Yusuf""""Martin O'Donnell""""Craig Anderson""""Irene Marzona""""Peter Sleight""""Jeff Probstfield""""Antonio Dans""""Peggy Gao""""Jackie Bosch""""Koon Teo""}"
493,208435,Comparison of tunnel positions in single-bundle anterior cruciate ligament reconstructions using computer navigation.,eng,Knee surgery sports traumatology arthroscopy : official journal of the ESSKA,Knee Surg Sports Traumatol Arthrosc,1433-7347,18,9,1/10/09,1282-9,"{""Travis G Maak""""Thomas L Wickiewicz""""Volker Musahl""""James E Voos""""Andrew D Pearle""}"
494,556624,Fludarabine vs cladribine plus busulfan and low-dose TBI as reduced intensity conditioning for allogeneic hematopoietic stem cell transplantation: a prospective randomized trial,empty,empty,empty,empty,39,4,1/7/01,193-9,"{""D. J. Weisdorf""""D. Douek""""Y. Tan""""L. J. Burns""""J. S. Miller""""B. R. Blazar""""M. Arora""""T. DeFor""""M. L. MacMillan""""M. Markova""""J. E. Wagner""""J. N. Barker""""T. Repka""}"
495,36253,[Limited experience in adrenocortical function tests in infants].,jpn,Horumon to rinsho. Clinical endocrinology,Horumon To Rinsho,0045-7167,16,4,4/1/68,273-6,"{""Y Hirose""""S Kurata""""Y Abe""}"
496,422857,Does this patient have obstructive sleep apnea?: The Rational Clinical Examination systematic review.,0,empty,J. Nucl. Med.,empty,310,7,1/13/08,731-741,"{""David L Simel""""Kathryn A Myers""""Marko Mrkobrada""}"
497,720372,APPLICATION OF AGING MANAGEMENT STRATEGIES FOR REACTOR VESSEL INTERNALS AND CORE SUPPORT STRUCTURES,empty,empty,Expert Opin Emerg Drugs,empty,0,0,0,277-286,"{""H. Q. Xu""""M. Snyder""""S. Fyfitch""""A. Cheta""""G. Bezdikian""""V. N. Shah""""T. R. Liszkai""""H. Charkas""""N. Gupta""""Y. Shoji""""C. S. Bajwa""""C. May""""M. Sanwarwala""""M. Brumovsky""""I. Ezekoye""}"
498,863342,Molecular detection of hepatitis B virus: Recent developments,0,empty,Croat.Med.J.,0,29,1,1/5/01,33-43,"{""B. Weber""""A. Berger""}"
499,260745,Droperidol vs metoclopramide for prophylaxis of postoperative nausea and vomiting after breast cancer surgery,empty,empty,empty,0,-1,1,1/11/01,141,"{""F. Coletta""""S. D'Arienzo""""P. Sansone""""C. Aurilio""""M. C. Pace""""G. Zagaria""""R. Stumbo""}"
500,941515,Is prolonged use of computer games a risk factor for deep venous thrombosis in children?,empty,Clinical medicine (London England),Clin Med,1473-4893,4,2,1/4/01,190-1,"{""Richard J. A. Murrin""}"
501,641972,[Pelvic floor training for women with urinary incontinence].,dan,empty,0,empty,169,7,12/7/02,593-5,"{""Sren Brostrm""""Gunnar Lose""}"
502,699523,Regulating free speech,English,empty,empty,empty,23,2,1/1/91,289-318,"{""David Dyzenhaus""}"
503,946112,Older Women in the Homeless Shelter: Personal Perspectives and Practice Ideas,empty,empty,Klin.Psikofarmakol.Bul.,empty,23,4,0,360-374,"{""Jennifer Davis-Berman""}"
504,958639,Ethically justified system-level decisions in health care: Toward a decision support workbook for healthcare leaders,eng,empty,J Environ Monit,empty,70,1,0,238,"{""Bashir Jiwani""}"
505,850418,Takayasu's arteritis with multiple intracranial aneurysms,empty,empty,empty,empty,23,1,0,60-61,"{""Matsumoto K.""""Yamada F.""""Fukuda S.""}"
506,125302,Intravenous cyclophosphamide in patients with chronic systemic inflammatory diseases: morbidity and mortality.,eng,Scandinavian journal of rheumatology,Scand. J. Rheumatol.,0300-9742,37,2,1/8/03,130-4,"{""E A M Janssen""""C Brodin""""P Ogreid""""K Kjellevold""""L G Gransson""""L Vatten""""P R Romundstad""""R Omdal""""K Wildhagen""}"
507,168889,Trends in domestic violence service and leadership: implications for an integrated shelter model,empty,Administration and policy in mental health,Adm Policy Ment Health,0894-587X,27,5,1/1/00,339-52,"{""M. B. Philip""""R. A. Hayward""}"
508,63977,[Clinical and histologic results of treatment of serous pulp inflammations with Ledermix].,pol,Czasopismo stomatologiczne,Czas Stomatol,Nov-53,20,11,1/1/67,1145-53,"{""H Zakrzewska-Jastrzebska""}"
509,782211,Application of a model based on fuzzy logic for evaluating nursing diagnostic accuracy of students,pol,empty,J Cell Biol,empty,82,9,0,875-81,"{""R. Jensen""""F. G. Matos""""A. da Cruz Dde""""P. S. Silveira""""M. H. Lopes""""N. R. Ortega""}"
510,473599,The effectiveness of N-acetylcysteine in preventing contrast-induced nephropathy in patients undergoing contrast-enhanced computed tomography: a meta-analysis of randomized controlled trials (Provisional abstract),0,empty,Biol.Blood Marrow Transplant.,empty,45,5,0,1309-1318,"{""Yh Hsu""""Ms Yao""""Cs Wong""""Ch Bai""""My Wu""""Yf Lin""""Cy Hsiang""""Kw Tam""""Yw Li""""Hf Hsiang""}"
511,915463,[Commentary on] Gait changes in children with cerebral palsy following a neuro-developmental treatment course. Adams M Chandler L Shuhmann K PEDIATRIC PHYSICAL THERAPY 2000;12:114-120,0,empty,Bioelectromagnetics,empty,14,1,1/2/01,55-56 2p,"{""J. Slusarski""}"
512,476199,Cognitive Outcome of Pediatric Moyamoya Disease.,eng,Journal of Korean Neurosurgical Society,J Korean Neurosurg Soc,2005-3711,57,6,1/15/06,440-4,"{""Ju-Seong Kim""""Dong-Seok Kim""""Eun-Kyung Park""""Kyu-Won Shim""}"
513,405141,Fruit consumption and risk of type 2 diabetes: results from three prospective longitudinal cohort studies.,eng,empty,Case Rep.Med.,empty,347,-1,0,f5001,"{""Rob M van Dam""""Frank B Hu""""Isao Muraki""""Joann E Manson""""Fumiaki Imamura""""Qi Sun""""Walter C Willett""}"
514,213794,A biomechanical study of replacement of the posterior cruciate ligament with a graft. Part II: Forces in the graft compared with forces in the intact ligament,English,empty,empty,0,79,3,1/1/97,381-386,"{""K.L. Armstrong""""G.A.M. Finerman""""K.L. Markolf""""M.S. Shapiro""""J.R. Slauterbeck""}"
515,408902,The safety and immunogenicity of rotavirus vaccination in infants with intestinal failure,empty,empty,empty,empty,3,1,0,57-65,"{""McNeal M.M.""""Sanchez S.E.""""Jacob S.""""Javid P.J.""""Englund J.A.""""Horslen S.P.""}"
516,89897,A growing lesion on the cheek.,0,JAMA otolaryngology-- head & neck surgery,Pharm Pract (Granada),2168-619X,140,4,1/14/04,383-4,"{""Eric J Lentsch""""Jordan Whitney Rawl""""Michael J Caplan""}"
517,187552,Protective effect of ginsenoside Rb1 against myocardial ischemia/reperfusion injury in streptozotocin-induced diabetic rats,empty,empty,Klin.Psikofarmakol.Bul.,empty,38,7,0,4327-4335,"{""Y. Wu""""Z. Y. Xia""""H. M. Liu""""S. Q. Lei""""L. Zhang""""J. J. Xu""""B. Zhao""""J. Dou""}"
518,144339,Comparative in vitro performance of three small-volume valved holding chambers with beclomethasone/formoterol pressurized metered dose inhaler.,0,Journal of aerosol medicine and pulmonary drug delivery,J Aerosol Med Pulm Drug Deliv,1941-2703,26,4,1/13/08,223-7,"{""Kamel Alhanout""""Jean-Christophe Dubus""""Talita Mota Goncalves""""Veronique Andrieu""""Alain Nicolay""""Davi Pereira de Santana""}"
519,656518,The effectiveness of anti-illicit-drug public-service announcements: a systematic review and meta-analysis.,eng,empty,0,empty,65,10,1/11/10,834-40,"{""Julio S G Montaner""""Kora Debeck""""Evan Wood""""Thomas Kerr""""Edward J Mills""""Dan Werb""}"
520,925315,[Use of statins prior to or following invasive therapy for coronary artery disease].,chi,CHUNG-HUA I HSUEH TSA CHIH [CHINESE MEDICAL JOURNAL],Chung Hua I Hsueh Tsa Chih,0376-2491,85,40,10/26/05,15-Jul,"{""Wei Gao""}"
521,130308,Malignant lymphomas of the oral region.,engfre,Canadian Forces Dental Services quarterly,Can Forces Dent Serv Q,0045-4850,18,1,1/1/77,7-Jan,"{""J R Trott""""D J Morrow""""D W Buntine""}"
522,237077,Women's experiences of acupuncture during labour,empty,empty,Biol.Blood Marrow Transplant.,empty,21,4,0,254-262,"{""Irena Anna Frei""""Katharina Fierz""""Angela Poat""""Martina Gisin""}"
523,600827,Nutritional supplementation for hip fracture aftercare in the elderly.,eng,empty,Physiol Res,empty,-1,4,1/1/00,CD001880,"{""A Avenell""""H H Handoll""}"
524,851773,Quality of life factors and survival after total or extended maxillectomy for sinonasal malignancies.,0,empty,Eur J Anaesthesiol,empty,73,4,1/15/04,759-63,"{""James Murphy""""Amal Isaiah""""Joshua E Lubek""""Jeffrey S Wolf""}"
525,67292,Epithelial Splicing Regulatory Proteins 1 (ESRP1) and 2 (ESRP2) Suppress Cancer Cell Motility via Different Mechanisms.,eng,The Journal of biological chemistry,J. Biol. Chem.,1083-351X,289,40,3/14/10,27386-99,"{""Mitsuyoshi Motizuki""""Keiji Miyazawa""""Tetsuo Kondo""""Keisuke Masuyama""""Masao Saitoh""""Hiroki Ishii""""Ryohei Katoh""""Kei Sakamoto""""Shota Tanaka""}"
526,129698,Combined and sequential treatment of oral and maxillofacial malignancies: an evolving concept and clinical protocol.,eng,Chinese medical journal,Chin. Med. J.,0366-6999,121,19,5/8/10,1945-52,"{""Zhi-yuan Zhang""""Wei-liu Qiu""""Jia-wei Zheng""}"
527,254327,Evaluation of a workshop on evidence-based medicine for social insurance physicians.,eng,empty,Scand. J. Rheumatol.,empty,58,2,1/8/03,Jul-83,"{""Jos H Verbeek""""Rob Kok""""Jan L Hoving""""Frederieke G Schaafsma""""Frank J H van Dijk""""Paul B A Smits""}"
528,556803,Neurocognitive assessment in 13 patients affected by muchopolysaccharidosis IVA (MPS IVA),0,empty,empty,0,37,1,1/14/01,S136,"{""M. Rigoldi""""S. Gasperini""""B. M. Del Menico""""F. Nichelli""""A. Boncimino""""M. Calabria""""P. Meregalli""""R. Parini""}"
529,73792,Evaluation of the protective effect of Ilex paraguariensis and Camellia sinensis extracts on the prevention of oxidative damage caused by ultraviolet radiation.,0,Environmental toxicology and pharmacology,Environ. Toxicol. Pharmacol.,1872-7077,37,1,1/14/01,195-201,"{""Marlon Barg""""Emilio L Streck""""Lara M Gomes""""Vanessa M Andrade""""Daniela D Leffa""""Felipe Dal-Pizzol""""Fabricia Petronilho""""Francieli Vuolo""""Milena Carvalho-Silva""""Fernanda Balbinot""""Gislaine T Rezin""}"
530,484593,New anticoagulants for atrial fibrillation.,eng,empty,0,empty,10,6,1/9/06,446-53,"{""Raffaele De Caterina""""Giulia Renda""""Steen Dalby Kristensen""}"
531,351700,Our Health Counts -- Unmasking Health and Social Disparities among Urban Aboriginal People in Ontario.,empty,empty,0,empty,8,0,0,0,"{""Michelle Firestone""}"
532,105981,A common variant in the FTO gene is associated with body mass index and predisposes to childhood and adult obesity.,eng,Science (New York N.Y.),Science,1095-9203,316,5826,11/7/05,889-94,"{""George Davey Smith""""Amanda J Bennett""""Eleftheria Zeggini""""Marjo-Riitta Jarvelin""""Nicholas J Wareham""""Lorna W Harries""""Colin N A Palmer""""Shah Ebrahim""""Timothy M Frayling""""Susan M Ring""""Bridget Knight""""Sian Ellard""""Katharine R Owen""""Rachel M Freathy""""Hana Lango""""Debbie A Lawlor""""Lon R Cardon""""John R B Perry""""Jeffrey C Barrett""""Andrew D Morris""""Graham A Hitman""""Katherine S Elliott""""Ulla Sovio""""Mark I McCarthy""""David Melzer""""Alex S F Doney""""Andrew R Ness""""Yoav Ben-Shlomo""""Andrew T Hattersley""""Ann-Marie Patch""""Nicholas J Timpson""""Nigel W Rayner""""Mark Walker""""Michael N Weedon""""Ruth J F Loos""""Fredrik Karpe""""In_s Barroso""""Luigi Ferrucci""""Christopher J Groves""""Cecilia M Lindgren""""Beverley Shields""}"
533,408198,The parvalbumin-positive interneurons in the mouse dentate gyrus express GABAA receptor subunits 1 _2 and  along their extrasynaptic cell membrane.,eng,Neuroscience,Neuroscience,1873-7544,254,-1,12/19/13,80-96,"{""H H_ger""""W Sieghart""""T Klausberger""""I Milenkovic""""M Vasiljevic""""D Maurer""}"
534,30272,Glial cells in amyotrophic lateral sclerosis.,ENG,Experimental neurology,Exp. Neurol.,1090-2430,0,-1,5/22/14,empty,"{""T Philips""""J D Rothstein""}"
535,623367,Diagnosing acute cardiac ischemia in the emergency department: a systematic review of the accuracy and clinical effect of current technologies.,eng,empty,0,empty,37,5,1/1/05,453-60,"{""J P Ioannidis""""J Lau""""C Milch""""D Salem""""P W Chew""""N Terrin""""E M Balk""}"
536,13408,Eczema - quiz.,eng,Paediatrics & child health,Paediatr Child Health,1918-1485,5,2,3/1/00,105,{NULL}
537,449003,Stroke in children with posterior fossa brain malformations hemangiomas arterial anomalies coarctation of the aorta and cardiac defects and eye abnormalities (PHACE) syndrome: A systematic review of the literature.,empty,empty,empty,empty,0,0,empty,0,{NULL}
538,299297,"Employing a youth-led adult-guided framework: ""why drive high?"" social marketing campaign.",empty,empty,0,empty,34,4,1/11/10,319-330,"{""Terry-Lynne Marko""""Tyler Watt""}"
539,302268,Review of Handbook for Working with Children and Youth: Pathways to Resilience across Cultures and Contexts,English,empty,empty,empty,47,3,1/6/01,230-232,"{""Robert J. Flynn""}"
540,592663,Helicobacter pylori antibiotic resistance patterns and genotypes in adult dyspeptic patients from a regional population in North Wales,empty,empty,empty,0,54,2,1/4/01,435-40,"{""A. M. Walker""""J. Xerry""""K. Davies""""N. C. Elviss""""R. J. Owen""}"
541,520843,Sonographically guided biopsy of focal lesions: a comparison of freehand and probe-guided techniques using a phantom.,eng,AJR. American Journal Of Roentgenology,AJR Am J Roentgenol,0361-803X,184,5,1/5/05,1652-6,"{""Duncan M Brooks""""Pramit M Phal""""Rory Wolfe""}"
542,460786,Splinting osseointegrated implants and natural teeth in partially edentulous patients: a systematic review of the literature. [Review],empty,empty,empty,empty,0,0,empty,empty,{NULL}
543,866131,Long-term subcutaneous recombinant interleukin-2 as maintenance therapy: Biological effects and clinical implications,empty,empty,Br J Clin Pharmacol,empty,10,3,0,195-203,"{""V. Lorusso""""M. De Lena""""M. Guida""""M. Correale""""I. Abbate""""A. Latorre""""A. Casamassima""""M. D. Musci""}"
544,751811,School soft drink intervention study,0,empty,Clin Med,empty,329,7462,1/4/01,E315-6,"{""S. A. French""""M. Story""""P. J. Hannan""}"
545,436781,Hoarse voice in adults: An evidence-based approach to the 12 minute consultation.,empty,empty,empty,empty,0,0,empty,0,{NULL}
546,796900,Chronic compartment syndrome an important cause of work-related upper limb disorder,0,Rheumatology (Oxford),Rheumatology (Oxford England),1462-0324,44,11,1/5/01,1442-6,"{""J. P. Heath""""R. L. Williams""""M. H. Pritchard""}"
547,491837,Sleep sleep-dependent procedural learning and vigilance in chronic cocaine users: Evidence for occult insomnia,English,empty,empty,empty,82,3,1/6/01,238-49,"{""R. T. Malison""""E. F. Pace-Schott""""V. Coric""""P. T. Morgan""""R. Stickgold""""Z. H. Sahul""}"
548,893227,A screening methodology for crowdsourcing video QoE evaluation,empty,empty,empty,empty,0,0,1/14/01,empty,"{""E. Anegekuh L. Sun L. Ifeachor""}"
549,525874,Potential for inter-observer and intra-observer variability in x-ray review to establish stone-free rates after lithotripsy.,eng,empty,0,empty,147,3,3/1/92,559-62,"{""D Caron""""S J Witchell""""M A Jewett""""E L St Louis""""R R Gray""""C Bombardier""""S Kumra""""K E Psihramis""""M R Ryan""}"
550,26475,Situating universal design architecture: designing with whom?,ENG,Disability and rehabilitation,Disabil Rehabil,1464-5165,-1,-1,7/28/14,6-Jan,"{""Paul Jones""}"
551,476191,Endovascular Treatment of Ruptured Large or Wide-Neck Basilar Tip Aneurysms Associated with Moyamoya Disease Using the Stent-Assisted Coil Technique.,ENG,Journal of stroke and cerebrovascular diseases : the official journal of National Stroke Association,J Stroke Cerebrovasc Dis,1532-8511,0,-1,7/24/15,0,"{""Yibin Fang""""Pengfei Yang""""Jianmin Liu""""Yi Xu""""Qinghai Huang""""Wenyuan Zhao""""Dongwei Dai""""Yan Chen""}"
552,719389,Subjective states: A more robust model,eng,empty,Obesity (Silver Spring),empty,67,2,0,408-427,"{""K. Seo""""L. G. Epstein""}"
553,467318,The fundamental role of bone morphogenetic protein 15 in ovarian function and its      involvement in female fertility disorders.,empty,empty,empty,empty,0,0,empty,0,{NULL}
554,268361,Giant-cell tumour of the knee: the condition of the cartilage after treatment by curettage and cementing,eng,J Bone Joint Surg Br,The Journal of bone and joint surgery. British volume,0301-620X (Print) 0301-620x,89,3,1/7/01,361-5,"{""K. Jonsson""""A. Rydholm""""I. Kristiansson""""D. Heinegard""""F. V. von Steyern""""P. Mannfolk""}"
555,664795,Diagnostic accuracy of endoscopic ultrasound-guided fine-needle aspiration for solid pancreatic lesion: a systematic review.,eng,Journal of cancer research and clinical oncology,J. Cancer Res. Clin. Oncol.,1432-1335,138,9,1/12/09,1433-41,"{""Hangcheng Zhou""""Renbao Yang""""Jiong Chen""""Yunlian Xia""""Yin Lu""}"
556,102180,Safety tolerability and sustained weight loss over 2 years with the once-daily human GLP-1 analog liraglutide.,0,International journal of obesity (2005),Int J Obes (Lond),1476-5497,36,6,1/12/06,843-54,"{""R Carraro""""M F Rasmussen""""L Niskanen""""A Harper""""N Finer""""S R_ssner""""M Kunesova""""L Van Gaal""""M E J Lean""""A Astrup""""A Rissanen""""M J Savolainen""""[Collective Name] NN8022-1807 Investigators""}"
557,258486,Web-based nutrition education intervention improves self-efficacy and self-regulation related to increased dairy intake in college students,English,empty,empty,empty,110,11,1/10/01,1723-7,"{""Kathy W Hosig""""Sharon M Nickols-Richardson""""Kavita H Poddar""""Susan E Duncan""""Eileen S Anderson""}"
558,961081,Three Abstracts on Chinese Research,0,empty,Biol.Blood Marrow Transplant.,empty,63,0,0,25-26,{NULL}
559,52681,Retrograde nailing of humeral shaft fractures,empty,empty,Movement disorders : official journal of the Movement Disorder Society,0,20,350,0,26-39,"{""M. Runkel""""J. Blum""""P. M. Rommens""}"
560,828156,Behavioral and cognitive measurements predict scores on the MAST: a 3-year prospective study.,eng,Alcohol Clin Exp Res,Alcoholism clinical and experimental research,0145-6008,20,7,10/1/96,1173-8,"{""V Hesselbrock""""A W Deckel""}"
561,812757,Development of a SNP genotyping panel and a medical decision support algorithm to predict drug response in schizophrenia,0,Klinik Psikofarmakoloji Bulteni,empty,1017-7833,21,0,1/11/01,S156-S157,"{""Y. A. Son""""G. Ustunkar""""M. A. Doke""""H. A. Dom""""Y. Y. Tuncel""}"
562,713518,ELDERLY AND PHYSICAL ACTIVITY: BENEFITS AND CHALLENGES IN SEARCH FOR LIFE QUALITY.,empty,Journal of Nursing UFPE / Revista de Enfermagem UFPE,REV ENFERMAGEM UFPE,1981-8963,6,11,1/12/11,2761-2769 9p,"{""Gerlane ngela da Costa Moreira""""Denyse Dutra Alencar Vasconcelos""""Amanda Costa de Freitas""""Carla Cristina Braga Maranho""""Danielle Figueiredo Patricio""}"
563,180977,Neighbourhood characteristics and mortality in the Atherosclerosis Risk in Communities Study,eng,empty,Clin Med,0,14,1,1/4/01,398-407,"{""L. N. Borrell""""K. Rose""""B. L. Clark""""D. Catellier""""A. V. D. Roux""}"
564,828214,Transference-focused psychotherapy v. treatment by community psychotherapists for borderline personality disorder: randomised controlled trial.,0,The British journal of psychiatry : the journal of mental science,Br J Psychiatry,1472-1465,196,5,1/10/05,389-95,"{""Philipp Martius""""Anna Buchheim""""Peter Buchheim""""Susanne H_rz""""Michael Rentrop""""Cord Benecke""""Peter Schuster""""Melitta Fischer-Kern""""Stephan Doering""}"
565,176160,The changing residential environments of older people,empty,empty,empty,empty,0,0,1/11/01,207-220,"{""Basta Beard Beard Beel-Bates Bierman Bowling Cagney Calkins Carder Carlsson Chan Clark Clarke Cutchin Cutler Davidoff Diehl Doty Durrett Feldman Foote Freedman Gaugler Gitlin Gitlin Glass Golant Golant Golant Golant Golant Golant Golant Grafova Gross Hunt Alley""""Stephen M. Golant""}"
566,677752,A systematic review of the surgical treatment of large incisional hernia.,0,Hernia : the journal of hernias and abdominal wall surgery,Hernia,1248-9204,19,1,1/15/02,89-101,"{""L Timmermans""""J C Slieker""""J F Lange""""E B Deerenberg""""J Jeekel""""D P Hogerzeil""""P H C Eilers""}"
567,107417,Fast-food habits weight gain and insulin resistance (the CARDIA study): 15-year prospective analysis.,0,Lancet,Lancet,empty,365,9453,1/5/01,36-42,"{""David R Jacobs""""David S Ludwig""""Cara B Ebbeling""""Alex I Kartashov""""Martha L Slattery""""Linda Van Horn""""Mark A Pereira""}"
568,141282,Early prenatal survival in relation to the parental environment in sheep: A review,empty,empty,0,empty,29,2,6/29/98,143-156,"{""E Decuypere""""E Dewil""""D Vanmontfort""""H Michels""}"
569,708911,Changing tides: improving outcomes through mentorship on all levels of nursing,English,empty,Expert Opin Emerg Drugs,empty,33,2,1/10/01,163-176,"{""J. Skees""""T. K. Race""}"
570,621640,Tracking cognitive decline in Alzheimer's disease using the mini-mental state examination: a meta-analysis.,eng,International psychogeriatrics / IPA,Int Psychogeriatr,1041-6102,12,2,6/1/00,231-47,"{""J McCusker""""F Primeau""""M Cole""""L Han""""F Bellavance""}"
571,647583,Pulmonary rehabilitation programs for patients with COPD.,engpor,empty,0,empty,37,4,1/11/07,544-55,"{""Ana Maria Baptista Menezes""""David Alejandro Gonzlez""""Elaine Cardozo Macedo""""Pedro Curi Hallal""""Maria de Ftima Maia""""Marli Knorst""""Samuel Carvalho Dumith""""Jeovany Mart_nez-Mesa""""Ricardo Bica Noal""""Fernando Csar Wehrmeister""""Jos Roberto Jardim""}"
572,361080,The Impact of Nursing Case Management on Women With Diabetes in Pregnancy,English,empty,Rev Lat Am Enfermagem,empty,41,0,0,S131-2,"{""Corinn Taylor""}"
573,283168,[Pharmacotherapy for conduct disorder in children and adolescents],English,empty,0,empty,151,7,1/12/01,421-6 435 434,"{""T. Levy""""Y. Bloch""}"
574,52633,Monteggia lesions in adults. A multicenter Bota study,0,empty,empty,0,19,0,1/1/96,78-83,"{""W. De Groote""""D. Stoffelen""""K. Govaerts""""P. Reynders""""P. L. Broos""""J. Rondia""}"
575,74821,Progesterone receptor PROGINS and +331G/A polymorphisms confer susceptibility to ovarian cancer: a meta-analysis based on 17 studies.,0,Tumour biology : the journal of the International Society for Oncodevelopmental Biology and Medicine,Tumour Biol.,1423-0380,35,3,1/14/03,2427-36,"{""Xinran Wang""""Chenhuan Ding""""Lilan Chen""""Shu Li""""Ting Liu""""Xia Yin""""You Wang""""Xiangjun Sun""""Wen Di""""He Li""}"
576,373015,Gene analysis of steroid 5 alpha-reductase 1 in hyperandrogenic women,empty,Croatian Medical Journal,Croat.Med.J.,0353-9504,46,4,1/5/01,664-669,"{""B. Heljic""""R. Komel""""I. Eminovic""""F. Gavrankapetanovic""""J. Prezelj""""J. Karamehic""}"
577,529562,Intravenous insulin treatment in acute stroke: a systematic review and meta-analysis of randomized controlled trials.,0,International journal of stroke : official journal of the International Stroke Society,Int J Stroke,1747-4949,9,4,1/14/06,489-93,"{""P Michel""""V Papavasileiou""""G Ntaios""""A Bargiota""""K Makaritsis""}"
578,574242,Hospitalized heart failure patients with preserved vs. reduced     ejection fraction in Dubai United Arab Emirates: a prospective     study,0,European journal of heart failure,Eur. J. Heart Fail.,1879-0844,16,4,1/14/01,454-460,"{""Al Sayed Hussain A""""Saheb Sharif-Askari N""""Sulaiman SA""""Al-Mulla AA""""Tabatabai S""""Saheb Sharif-Askari F""}"
579,966388,Multiple endocrine neoplasia type 1 with multiple leiomyomas linked to a novel mutation in the MEN1 gene,English,Yonsei Medical Journal,Yonsei Med.J.,1976-2437,49,4,1/8/01,655-661,"{""H. Choi""""E. S. Kang""""S. K. Lim""""S. Y. Jeong""""H. C. Lee""""H. J. Kim""""S. Kim""""Y. Rhee""""Y. H. Lee""""J. H. Moon""""K. R. Kim""""C. W. Ahn""""B. S. Cha""""E. J. Lee""}"
580,919014,[Anesthetic gases exposure: findings from a 13 year environmental and biological monitoring in a hospital company].,ita,empty,0,empty,29,3,1/7/07,411-3,"{""M A Sanchez""""S Ritzu""""V Capelli""""P Boccalon""""G Arcangeli""}"
581,494428,Out-of-hospital cardiac arrests occurring in southern Ontario health care clinics: bystander cardiopulmonary resuscitation and automated external defibrillator use.,0,Canadian family physician Medecin de famille canadien,Can Fam Physician,1715-5258,56,6,1/10/06,e213-8,"{""Karen K Lam""""Steven C Brooks""""Laurie J Morrison""}"
582,55809,Diffusion tensor imaging of deep gray matter in children treated for brain malignancies.,0,Child's nervous system : ChNS : official journal of the International Society for Pediatric Neurosurgery,Tumour Biol.,1433-0350,30,4,1/14/04,631-8,"{""Anna Nidecker""""Siamak Ardekani""""E Mark Mahone""""Firouzeh Tannazi""""Jarunee Intrapiromkul""""Moody Wharam""""Larry J Brant""""Alena Horsk""}"
583,368651,A randomized controlled trial of paracetamol versus morphine for the treatment of acute painful crisis of sickle cell disease,pol,empty,J Health Care Poor Underserved,0,20,5,0,S149,"{""R. Rehmani""}"
584,423691,Puberty suppression in adolescents with gender identity disorder: a prospective follow-up study,0,empty,J Cell Sci,0,8,8,0,2276-83,"{""T. A. Doreleijers""""P. T. Cohen-Kettenis""""A. L. de Vries""""T. D. Steensma""}"
585,435904,A meta-analysis of clinical trials comparing mirtazapine with selective serotonin reuptake inhibitors for the treatment of major depressive disorder.,empty,empty,empty,empty,0,0,empty,0,{NULL}
586,407245,Group physiotherapy provides similar outcomes for participants after joint replacement surgery as 1-to-1 physiotherapy: a sequential cohort study.,eng,Archives Of Physical Medicine And Rehabilitation,Arch Phys Med Rehabil,1532-821X,90,10,1/9/10,1727-33,"{""Corinne L Coulter""""Jennie M Scarvell""""Jeanie M Weber""}"
