index,id,article_title,article_language,journal_title,journal_abbreviation,journal_issn,article_jvolumn,article_jissue,article_jcreated_at,article_pagination,author_list
197,143029,Steroids and antihistamines synergize to inhibit rat's airway smooth muscle contractility.,ENG,European archives of oto-rhino-laryngology : official journal of the European Federation of Oto-Rhino-Laryngological Societies (EUFOS) : affiliated with the German Society for Oto-Rhino-Laryngology - Head and Neck Surgery,Eur Arch Otorhinolaryngol,1434-4726,0,-1,8/13/14,0,"{""Shao-Cheng Liu""""Chi-Chung Wu""""Hsing-Won Wang""""Chuan-Hsiang Kao""""Yueng-Hsiang Chu""}"
198,667611,Reasons for and against participation in studies of medicinal therapies for women with breast cancer: a debate.,eng,empty,PloS one,empty,0,-1,0,25,"{""Marion Habersack""""Irmina-Anna Gerlich""""Gero Luschin""}"
199,565079,The effect of preservation solutions for storage of liver allografts on transplant outcomes: a systematic review and meta-analysis.,0,Annals Of Surgery,Epilepsy Res.,1528-1140,260,1,1/14/07,46-55,"{""John M O__Callaghan""""Robert D Morgan""""Peter J Morris""""Simon R Knight""}"
200,348006,Ultrasonically enhanced vancomycin activity against Staphylococcus epidermidis biofilms in vivo.,eng,Journal of biomaterials applications,J Biomater Appl,0885-3282,18,4,1/4/04,237-45,"{""R A Robison""""J L Nelson""""B L Roeder""""B L Beckstead""""G B Schaalje""""J C Carmen""""W G Pitt""""C M Runyan""}"
201,55412,Cuneus and fusiform cortices thickness is reduced in trigeminal neuralgia.,0,The journal of headache and pain,Oral Surg Oral Med Oral Pathol Oral Radiol,1129-2377,15,-1,1/14/12,17,"{""Thomas Martin Doring""""Maud Parise""""Gustavo Tukamoto""""Emerson Leandro Gasparetto""""Tadeu Takao Almodovar Kubo""""Maurice Vincent""}"
202,546048,The Impact of Read Right: Semester-Only versus Year-Long Inplementation,pol,empty,Biol.Blood Marrow Transplant.,empty,0,0,0,0,"{""John B. Sell""}"
203,979292,Muscle - tendon unit mechanical and morphological properties and sprint performance.,eng,Journal of sports sciences,J Sports Sci,0264-0414,25,9,1/7/07,1035-46,"{""Savvas Stafilidis""""Adamantios Arampatzis""}"
204,971456,An insulin-like growth factor-I gene polymorphism modifies the risk of microalbuminuria in subjects with an abnormal glucose tolerance,0,empty,0,0,21,5,1/6/01,715-721,"{""H. A. P. Pols""""C. M. van Duijin""""S. W. J. Lamberts""""I. Rietveld""""A. Hofman""""J. A. M. J. L. Janssen""}"
205,533193,Biofeedback dialysis for hypotension and hypervolemia: a systematic review and meta-analysis.,0,Nephrology dialysis transplantation : official publication of the European Dialysis and Transplant Association - European Renal Association,Case Rep.Med.,1460-2385,28,1,0,182-91,"{""Elie A Akl""""Gordon Guyatt""""Stephen D Walter""""Rita S Suri""""Reem A Mustafa""""Gihad E Nesrallah""""Robert M Lindsay""}"
206,970436,Cytokine profiling of young overweight and obese female African American adults with prediabetes,0,Cytokine,Cytokine,1096-0023,64,1,1/13/01,310-5,"{""J. Bhagatwala""""W. Caldwell""""D. H. Guo""""A. Mellor""""H. Zhu""""R. Caldwell""""R. Lucas""""S. J. Parikh""""Y. Dong""""S. Sridhar""""Y. Dong""}"
207,437969,Review of prasugrel for the secondary prevention of atherothrombosis.,empty,empty,empty,empty,0,0,empty,0,{NULL}
208,464335,Stereotactic radiosurgery for spinal metastases: a literature review. [Review],empty,empty,empty,empty,0,0,empty,0,{NULL}
209,417782,Pancreatic surgery. A paradigm for progress in the age of the bottom line,eng,Arch Surg,Archives of surgery (Chicago Ill. : 1960),0004-0010 (Print) 0004-0010,130,3,1/1/95,240-6,"{""A. L. Warshaw""}"
210,979059,Difference in fascicle behaviors between superficial and deep quadriceps muscles during isometric contractions.,ENG,Muscle & nerve,Muscle Nerve,1097-4598,0,1,10/15/09,0,"{""Hiroshi Akima""""Kazunori Nosaka""""Aya Tomita""""Anthony J Blazevich""""Takayuki Inami""""Ryosuke Ando""""Kohei Watanabe""}"
211,661572,Losing life and livelihood: a systematic review and meta-analysis of unemployment and all-cause mortality.,eng,Social science & medicine (1982),Soc Sci Med,1873-5347,72,6,1/11/03,840-54,"{""David J Roelfs""""Joseph E Schwartz""""Eran Shor""""Karina W Davidson""}"
212,132901,Evaluation of a rapidly rotating shift system for tolerance of nurses to nightwork.,eng,International archives of occupational and environmental health,Int Arch Occup Environ Health,0340-0131,65,5,1/1/94,305-11,"{""D Minors""""J Waterhouse""""G Ghirlanda""""G Costa""""G Tarondi""}"
213,245822,[Osteoporosis prevention in patients with low energy hip fractures hospitalized in the orthopedic department],dan,Ugeskr Laeger,Ugeskrift for laeger,0041-5782 (Print) 0041-5782,164,27,1/2/01,Apr-41,"{""C. B. Mogensen""""I. B. Jacobsen""""L. Wiboe""}"
214,440401,American palm ethnomedicine: a meta-analysis..,empty,empty,empty,empty,0,0,empty,0,{NULL}
215,77389,Symptoms tell it all: a systematic review of the value of symptom assessment to predict survival in advanced cancer patients.,0,Critical reviews in oncology/hematology,Crit. Rev. Oncol. Hematol.,1879-0461,84,1,1/12/10,130-48,"{""Emile E Voest""""Saskia C C M Teunissen""""Alexander de Graeff""""Marija Trajkovic-Vidakovic""}"
216,592817,Isolates and antibiotic resistance of culture-proven endophthalmitis cases presented to a referral center in Tehran,English,empty,BMC Neurol,empty,19,4,1/12/01,361-3,"{""M. M. Parvaresh""""M. Hashemi""""R. Soodi""""S. Nekoozadeh""""S. A. Alemzadeh""""K. G. Falavarjani""""M. Modarres""}"
217,169270,Public health impact of the 1992 Los Angeles civil unrest,empty,Public health reports (Washington D.C. : 1974),Public Health Rep,0033-3549,108,3,1/1/93,265-72,{NULL}
218,288711,Laparoscopic reversal of Hartmann's rectosigmoidectomy,empty,0,Rev.Neurol.,1462-8910,10,1,1/8/01,81-83,"{""S. Slawik""""A. R. Dixon""}"
219,184949,The situation of Romanian HIV-positive adolescents: Results from the first national representative survey,English,empty,empty,0,-1,2,0,562-569,"{""D. Buzducea""""Buzducea Cohen Johnson Lazar Lazar Lejars Lyon Marin McDowell Mardarescu O'Leary Paxton Wood Berger""""F. Lazar""""E. I. Mardare""}"
220,833251,Life stress and the long-term treatment course of recurrent depression: III. Nonsevere life events predict recurrence for medicated patients over 3 years,English,empty,Circulation,0,13,3,1/6/01,112-120,"{""E. Frank""""L.D. Torres""""D. Kupfer""""K.L. Harkness""""J. Guillaumot""""J.E. Roberts""""S.M. Monroe""}"
221,470174,Value of spiral CT in hemodynamically stable patients following blunt chest trauma.,eng,Computerized Medical Imaging and Graphics: The Official Journal of the Computerized Medical Imaging Society,Comput Med Imaging Graph,0895-6111,22,6,11/1/98,447-52,"{""R Tello""""K Kandarpa""""R F Munden""""S Hooton""""R Pugatch""}"
222,315926,Preventing injuries through interventions for problem drinking: a systematic review of randomized controlled trials,0,empty,empty,empty,34,4,1/1/99,609-21,"{""I. Roberts""""E. Heitman""""C. Diguiseppi""""T. Dinh-Zarr""}"
223,901385,Nutrition and obstructed labor,0,empty,empty,0,17,1,empty,291S-297S,"{""O. A. Ladipo""""J. C. Konje""}"
224,787529,Rationale design and methods of the HEALTHY study nutrition intervention component,0,Int J Obes (Lond),empty,0307-0565,33,0,0,S29-36,"{""S. McCormick""""B. Gillis""""A. Virus""""M. A. Staten""""C. Mobley""""S. L. Volpe""""J. Bridgman""""L. El ghormli""""D. D. Stadler""""J. Hartstein""}"
225,431348,Atomoxetine treatment of children and adolescents with ADHD: Clinical questions and answers. (German),empty,empty,empty,empty,0,0,empty,0,{NULL}
226,441393,The novel applications of the quantitative analysis of neutrophil cell surface FcgammaRI (CD64) to the diagnosis of infectious and inflammatory diseases.,empty,empty,empty,empty,0,0,empty,0,{NULL}
227,481882,Inhibition of cisplatin-induced lipid catabolism and weight loss by ghrelin in male mice.,0,Endocrinology,Endocrinology,1945-7170,154,9,1/13/09,3118-29,"{""Thomas Scherer""""Jose M Garcia""""Victor Papusha""""Ji-an Chen""""Mark Asnicar""""Joanna Smiechowska""""Bobby Guillory""""Christoph Buettner""""Roy G Smith""""Anriada Nassif""}"
228,572425,Primary cutaneous large B-cell lymphoma of the legs: a distinct clinical pathologic entity treated with CD20 monoclonal antibody (rituximab).,eng,empty,Oncol Nurs Forum,empty,24,3,0,237-40,"{""D M Aboulafia""}"
229,581864,Improving Implementation of Classroom Instruction through Teacher-Directed Behavioral Consultation: A Single-Case Demonstration,0,empty,Circulation,empty,2,3,0,432-438,"{""Marcie W. Handler""""James K. Luiselli""""Jennifer A. Mautone""}"
230,455406,Green tea in dermatology. [Review],empty,empty,empty,empty,0,0,empty,0,{NULL}
231,696362,Teaching Calculus and Other Challenging Courses to Nontraditional and At-Risk Students at a Research University.,empty,McNeill Mathematics Program,College Teaching,87567555,54,4,1/6/01,291-297,"{""C. G. Mendez""}"
232,504206,Tropical infection after a case of total hip arthroplasty.,0,The Journal of hospital infection,J. Hosp. Infect.,1532-2939,87,3,1/14/07,179-81,"{""E Senneville""""H Melliez""""V Lovi""""C Joseph""""M Douaud""""M Pradier""""T Boyer""""A Meybeck""""L Fortin-Lebraud""}"
233,800900,Chronic pelvic pain.,0,Best practice & research. Clinical gastroenterology,Best Pract Res Clin Gastroenterol,1532-1916,23,4,1/9/01,593-610,"{""Andrew Paul Baranowski""}"
234,235689,Obstetrical anal sphincter laceration and anal incontinence 5-10 years after childbirth,0,Am J Obstet Gynecol,PloS one,0002-9378 (Print)x 0002-9378,207,5,1/12/01,425.e1-6,"{""K. C. McDermott""""J. L. Blomquist""""V. L. Handa""""E. C. Evers""}"
235,659896,Comparative effectiveness of instructional design features in simulation-based education: systematic review and meta-analysis.,0,Medical teacher,Journal of graduate medical education,1466-187X,35,1,0,e867-98,"{""Benjamin Zendejas""""Stanley J Hamstra""""Rose Hatala""""David A Cook""""Amy T Wang""""Jason H Szostek""""Patricia J Erwin""""Ryan Brydges""}"
236,84944,Body mass index and outcome of ASC-H-interpreted cervical smears in postmenopausal women.,0,Acta cytologica,BMC Neurol,Jan-47,56,3,1/12/01,259-65,"{""Jae Jun Lee""""Sang Yong Song""""Soomin Ahn""""Young Lyun Oh""""Ji-Youn Sung""""Chang Ohk Sung""""Yoo-Young Lee""}"
237,326944,Plasma concentration of asymmetric dimethylarginine and the risk of coronary heart disease: rationale and design of the multicenter CARDIAC study.,eng,Atherosclerosis. Supplements,Atheroscler Suppl,1567-5688,4,4,1/3/12,29-32,"{""Andreas M_gge""""Christoph Hanefeld""""Rainer H B_ger""""[Collective Name] CARDIAC study investigators""}"
238,922795,[Toxicology and clinical significance of base-catalized degradation of sevoflurane to Compound A].,ger,empty,0,empty,45,-1,2/1/96,S10-3,"{""R M Jones""""P Conzen""}"
239,768486,Functionality and feedback: a protocol for a realist synthesis of the collation interpretation and utilisation of PROMs data to improve patient care,empty,empty,PloS one,empty,4,7,0,e005601,"{""C. Mills""""S. Dalkin""""J. Greenhalgh""""C. Wood""""L. Wood""""J. Wright""""E. Gibbons""""N. Black""""J. M. Valderas""""R. Pawson""""D. Meads""}"
240,428363,Case report. Cutaneous cryptococcosis in a patient with systemic erythematous lupus.,eng,Mycoses,Mycoses,0933-7407,44,9,1/1/11,419-21,"{""L Ramos""""S Mathur_n""""A Mateo""""C L_pez""""C G_mez""}"
241,519287,A method for determining skeletal lengths from DXA images.,0,BMC Musculoskelet Disord,BMC musculoskeletal disorders,1471-2474,8,-1,1/7/01,113,"{""Glen M Blake""""Tim D Spector""""Ignac Fogelman""""Usha Chinappen-Horsley""}"
242,638918,Imaging for target volume delineation in rectal cancer radiotherapy--a systematic review.,eng,empty,Trans. R. Soc. Trop. Med. Hyg.,empty,24,1,1/12/02,52-63,"{""R Webster""""E Spezi""""S Mukherjee""""R Adams""""S Gwynne""""J Staffurth""""B Coles""}"
243,111336,The influence of smoking and impaired glucose homoeostasis on the outcome in patients presenting with an acute coronary syndrome: a cross-sectional study.,empty,empty,PloS one,empty,4,7,0,e005077,"{""Anders Halling""""Hkan Odeberg""""Henrik Forssell""""Jacob Odeberg""""Marie-Louise Persson""""Lennart Rstam""""Ivar Vaara""""Ulf Lindblad""""Michael Freitag""}"
244,747279,Systematic review exploring the effect of exercise in pulmonary rehabilitation on depression levels in patients with chronic obstructive pulmonary disease,0,Physiotherapy,empty,1873-1465,97,0,0,eS502-eS503,"{""Patil S.""""Horobin H.""}"
245,674696,Environmental and genomic factors as well as interventions influencing smoking cessation: a systematic review of reviews and a proposed working model.,0,Public health genomics,Journal of graduate medical education,1662-8063,16,4,1/13/01,159-73,"{""A Brand""""J Van der Heyden""""S de Viron""""H Van Oyen""""N Malats""}"
246,258108,Impact of seasonality on recruitment retention adherence and outcomes in a web-based smoking cessation intervention: randomized controlled trial,pol,empty,Biol.Blood Marrow Transplant.,0,-1,0,0,e249-,"{""Mushro A""""Niaura R S""""Graham A L""""Cobb N K""""Fang Y""""Cha S""}"
247,59308,White matter diffusivity predicts memory in patients with subjective and mild cognitive impairment and normal CSF total tau levels.,0,Journal of the International Neuropsychological Society : JINS,Journal of orthopaedic science : official journal of the Japanese Orthopaedic Association,1469-7661,16,1,1/10/01,58-69,"{""Ramune Grambaite""""Anders M Fjell""""Tormod Fladby""""Kristine B Walhovd""""Vidar Stenset""""Ivar Reinvang""}"
248,610641,Comparison between open and closed suction systems: a systematic review.,ENGPOR,Revista Brasileira de terapia intensiva,Rev Bras Ter Intensiva,1982-4335,20,4,1/8/12,331-338,"{""Luiz Rogrio de Carvalho Oliveira""""Nilza Aparecida Almeida de Carvalho""""Flvio C L Cavalcanti Ara_jo""""Izabela Menezes Pagotto""""Paulo Chiavone""}"
249,631704,Association between interleukin-10 promoter polymorphisms and endometriosis: a meta-analysis.,eng,Gene,Gene,1879-0038,515,1,2/15/13,49-55,"{""Qiong Chen""""Wei Fan""""Qianhong Ma""""Zhongying Huang""""Zhun Xiao""""Shangwei Li""}"
250,846537,Overactive bladder: Optimizing quality of care,empty,empty,empty,empty,7,2,0,S46-S61,"{""Lemack G.E.""}"
251,973076,Thyroid-related autoantibodies and celiac disease: a role for a gluten-free diet?,0,empty,0,empty,35,3,1/2/09,245-8,"{""E. Mainardi""""G. Moscato""""A. Montanelli""""M. Dotti""""R. Nano""}"
252,931402,Providing access to specialty care for severely disabled institutional residents: an academic health center telemedicine model,eng,empty,J Environ Monit,empty,20,2,0,415-422 8p,"{""A. K. Marcee""""S. P. Roaten""""J. B. Morrow""""K. J. Kowalske""""L. E. Snell""""L. L. Goetz""}"
253,908690,A robust method for diagnosis of morphological arrhythmias based on Hermitian model of higher-order statistics,0,Biomedical engineering online,Biomed Eng Online,1475-925X,10,0,1/11/01,22,"{""Address Correspondence""""S. Karimifard""""Addresses Author""""ahmadian@sina.tums.ac.ir """"Tehran Medical Physics""""Tehran Medical Physics""""Department of Biomedical Systems S. Karimifard""""Tums Tehran Iran Email University of Medical Sciences""""A. Ahmadian""""Tums Tehran Iran University of Medical Sciences""""Systems Department of Biomedical""}"
254,417373,Shared decision making and the future of managed care,empty,empty,0,empty,1,1,1/1/97,15-16,"{""J. E. Wennberg""}"
255,759329,Specific plasma factors blocking human maternal cell-mediated immune reaction to placental antigens.,eng,Nature: New biology,Nature New Biol.,0090-0028,242,117,3/28/73,110-1,"{""V Youtananukorn""""P Mantangkasombut""}"
256,386327,MicroRNAs: a new piece in the paediatric cardiovascular disease puzzle.,0,Cardiology in the young,Curr Drug Targets,1467-1107,23,5,1/13/10,642-55,"{""Dalia Elimam""""Keith A Webster""""Ahmed Omran""""Fei Yin""""Lina A Shehadeh""}"
257,695010,Association of Ureaplasma urealyticum colonization with development of bronchopulmonary dysplasia: a systemic review and meta-analysis.,0,Journal of Huazhong University of Science and Technology. Medical Sciences,Tumour Biol.,1672-0733,34,2,0,265-9,"{""Jia-rui Pu""""Dan Li""""De-hua Yang""""Li-duan Zheng""""Xiao-dan Zheng""""Hong Mei""""Xuan Xiang""""Qiang-song Tong""}"
258,191908,Mortality at older ages and moves in residential and sheltered housing: evidence from the UK,empty,empty,0,empty,68,6,0,524-529,"{""J. Falkingham""""M. Evandrou""""A. Vlachantoni""""J. Robards""}"
259,384767,A multinational study of thromboprophylaxis practice in critically ill children.,0,Critical care medicine,Crit. Care Med.,1530-0293,42,5,1/14/05,1232-40,"{""Sarah H O'Brien""""Marisa Tucci""""Antonio Rodriguez Nunez""""Philip C Spinella""""Li Qin""""Edward Vincent S Faustino""""Adrienne G Randolph""""Edward Truemper""""Simon Li""""Kimberly Marohn""""Sheila Hanson""""Michael Yung""""[Collective Name] PROphylaxis against ThRombosis prACTice (PROTRACT) Study Investigators of the PALISI BloodNet""}"
260,855912,Asymmetric inheritance of mitochondrial content in aging budding yeast cells,English,empty,0,empty,23,24,1/12/01,empty,"{""E. A. Martin""""L. F. Costa""""H. Li""""Y. Zhang""""M. P. Viana""""S. M. Rafelski""""W. F. Marshall""}"
261,710727,Physical activity moderates time-of-day differences in older adults' working memory performance.,empty,empty,0,empty,32,4,1/6/10,431-446 16p,"{""DeLosh EL""""Bugg JM""""Clegg BA""}"
262,816996,Uses of the electrical skin resistance method in the study of patients with neck and upper extremity pain,0,Johns Hopkins Medical Journal,JOHNS HOPKINS MED. J.,0,16,10,1/1/75,69-74,"{""C.P. Richter""""L.H. Riley Jr.""}"
263,625016,[New aspects in hernia surgery].,ger,empty,0,empty,44,7,1/5/07,774-9,"{""P E Goretzki""""B J Lammers""""T Otto""}"
264,275675,An exploration of self-reported negative affect by adolescents as a reason for smoking: implications for tobacco prevention and intervention programs,0,Prev Med,Pediatrics,0091-7435,41,2,1/5/01,589-96,"{""J. Robinson""""D. W. Smith""""B. Colwell""""S. L. Stevens""""C. McMillan""}"
265,967376,Diagnosis of peripheral lung cancer with three echoic features via endobronchial ultrasound,empty,empty,Proc.Natl.Acad.Sci.U.S.A.,0,25,4,0,922-9,"{""H. C. Chen""""S. M. Lin""""C. L. Chou""""C. T. Yu""""H. P. Kuo""""C. H. Kuo""}"
266,640230,A meta-analysis of labor supply effects of interventions for major depressive disorder.,eng,empty,0,empty,57,2,1/6/02,212-8,"{""Justin W Timbie""""Marcela Horvitz-Lennon""""Sharon-Lise T Normand""""Richard G Frank""}"
267,625663,Combined pharmacotherapy and psychological treatment for depression: a systematic review.,eng,Archives of General Psychiatry,Arch.Gen.Psychiatry,0003-990X,61,7,1/4/07,714-9,"{""Paola Bollini""""Giuseppe Tibaldi""""Bruce Kupelnick""""Carmine Munizza""""Sandro Pampallona""}"
268,480649,Dyspareunia and sexual dysfunction following vaginal delivery in thai primiparous women with second degree perineal tear: A prospective cohort study,German,empty,0,0,-1,1,1/15/01,58,"{""A. Ungkanungdecha""""C. Chayachinda""""J. Veeragul""""J. Jisabai""}"
269,782541,eComment. EuroSCORE II - corrected in-hospital mortality rate in a modern cohort of patients undergoing cardiac surgery,0,Interactive Cardiovascular & Thoracic Surgery,Eur. J. Heart Fail.,1569-9285,19,5,1/14/01,733,"{""D. G. Nezic""}"
270,692358,The effect of a cervical lateral glide on the upper limb neurodynamic test: a blinded placebo-controlled investigation,empty,empty,0,empty,0,0,1/3/01,10-Oct,"{""A Green""""J Lewis""""C Worsfold""""J Saranga""}"
271,836847,Thoracic Aortic Aneurysm: Reading the Enemy's Playbook,empty,empty,empty,empty,33,5,0,203-277,"{""Elefteriades J.A.""}"
272,867207,Early predicting of blood component quality by Statistical Process Control,empty,empty,Expert Opin Emerg Drugs,empty,99,0,0,227,"{""H. Jungk""""W. Madla""""V. Schottstedt""""T. Alt""}"
273,253149,Lifetime risk of suicide in affective disorders,empty,empty,0,empty,173,0,0,185-185,"{""A. S. Lee""""S. Davies""""P. C. Naik""}"
274,929971,A geographic analysis of chronically homeless adults before and after enrollment in a multi-site supported housing initiative: community characteristics and migration,empty,empty,Klin.Psikofarmakol.Bul.,empty,48,3,0,341-51,"{""R. A. Rosenheck""""J. Tsai""""A. S. Mares""}"
275,470385,Fetal cleft lip and palate detection by three-dimensional ultrasonography,empty,empty,empty,empty,16,4,0,314-320,"{""Lee W.""""Kirk J.S.""""Shaheen K.W.""""Romero R.""""Hodges A.N.""""Comstock C.H.""}"
276,731703,Substance Abuse and Trauma in Incarcerated Women,empty,empty,empty,empty,0,0,1/11/01,0,"{""NCT01413984 ""}"
277,113399,Use of Job Design to Reduce Mechanical Stress on the Back,empty,empty,empty,empty,0,0,1/1/89,323-326,"{""D. W. Badger""}"
278,685178,Rehabilitation of swallowing by exercise in tube-fed patients with pharyngeal dysphagia secondary to abnormal UES opening.,eng,empty,Oper Dent,empty,122,5,1/2/05,1314-21,"{""Mark Kern""""Karen Dikeman""""Barbara Grande""""Marta Kazandjian""""Terilynn Nitschke""""Stephanie Daniels""""Benson Massey""""Reza Shaker""""Caryn Easterling""}"
279,653325,A meta-analysis of two genome-wide association studies identifies 3 new loci for alcohol dependence.,eng,Journal of psychiatric research,J Psychiatr Res,1879-1379,45,11,1/11/11,1419-25,"{""Min Zeng""""Yue Pan""""Qunyuan Zhang""""Ke-Sheng Wang""""Nagesh Aragam""""Xuefeng Liu""}"
280,893573,Crowdsourced Multimedia Enhanced Spatio-temporal Constraint Based on-Demand Social Network for Group Mobility,empty,empty,Stroke,empty,0,0,0,761-762,"{""Ahmad Qamar""""Muhammad Shahid""""Md. Abdur Rahman""""Ahmed Lbath""""Akhlaq Ahmad""""Faizan Ur Rehman""""Abdullah Murad""""Bilal Sadiq""}"
281,56272,Impaired default network functional connectivity in autosomal dominant Alzheimer disease.,eng,Neurology,Neurology,1526-632X,81,8,8/20/13,736-44,"{""Virginia D Buckles""""Andrew J Saykin""""Eric McDade""""Stephen P Salloway""""Aaron P Schultz""""Peter R Schofield""""Randall Bateman""""Adam M Brickman""""Nick C Fox""""John C Morris""""John M Ringman""""Christopher C Rowe""""Paul Thompson""""Clifford Jack""""Beau M Ances""""Allison M Goate""""Robert A Koeppe""""Stephen Correia""""Jasmeer P Chhatwal""""Caroline A Sullivan""""Anne M Fagan""""Richard Mayeux""""Daniel S Marcus""""Tammie L S Benzinger""""Keith Johnson""""Reisa A Sperling""""Chengjie Xiong""}"
282,737786,Cranial reconstruction of major traumatic defects in children with osteoinductive and resorbable materials,empty,empty,Klin.Psikofarmakol.Bul.,empty,40,0,1/11/01,1024-1025,"{""R. R. M. Bos""""E. W. Hoving""""M. Wagemakers""}"
283,680306,Meta-analysis of the effects of sometribove zinc suspension on the production and health of lactating dairy cows.,0,Journal of the American Veterinary Medical Association,J ECT,1943-569X,245,5,1/14/09,550-64,"{""William W Thatcher""""Normand R St-Pierre""""Dale E Bauman""""Joseph S Hogan""""K Larry Smith""""Robert J Collier""""George A Milliken""""Jan K Shearer""}"
284,53877,Journal of Health Communication : International Perspectives The Effect of an Internet-Based  Stage- Matched Message Intervention on Young Taiwanese Women ' s Physical Activity,empty,empty,empty,empty,0,0,1/14/01,37-41 DO  - 10.1080/10810730902805788,"{""Sheu-jen Huang""""Maiga Chang""""Wen-chi Hung""""Janie Chang""}"
285,504928,Azathioprine for multiple sclerosis,empty,empty,empty,empty,0,4,1/7/01,0,"{""Ilaria Casetta""""Gerardo Iuliano""""Graziella Filippini""}"
286,198650,Wound care,0,empty,J Am Diet Assoc,empty,-1,1,1/1/92,27-32 ST  - Wound care-,{NULL}
287,671386,Comparison between incidental malignant and benign breast lesions detected by computed tomography: a systematic review.,0,Journal of medical imaging and radiation oncology,Curr. Opin. Pediatr.,1754-9485,57,5,1/13/10,529-33,"{""Jasmin Abbas""""Cholpan Jasaabuu""""Andreas Gunter Bach""""Alexey Surov""""Dominik Schramm""""Andreas Wienke""}"
288,981412,Plant Kunitz proteinase inhibitor attenuates inflammation oxidative stress and remodeling induced by elastase in mice,eng,empty,0,0,-1,1,1/14/01,empty,"{""N. M. Pinheiro""""R. Almeida-Reis""""L. Oliva""""M. A. Martins""""M. L. V. Oliva""""O. A. Theodoro-Junior""""E. A. Leick""""I. F. L. C. Tibrio""""C. M. Prado""""R. F. Righetti""""B. T. M. Oliveira""}"
289,785472,Streptococcus pneumoniae carriage in the Gaza strip,eng,PLoS One,PloS one,1932-6203,7,4,1/12/01,e35061,"{""G. Rahav""""G. Regev-Yochay""""I. Abullaish""""A. Elhamdany""""R. Malley""""M. Raz""""A. Goral""""Y. Roytman""""B. Shainberg""""M. Varon""""A. Ziv""}"
290,734077,Direct healthcare costs and cost-effectiveness of acute coronary syndrome secondary prevention with ticagrelor compared to clopidogrel: Economic evaluation from the public payer's perspective in Poland based on the PLATO trial results,empty,empty,Respirology,empty,72,9,0,823-830,"{""M. Niewada""""J. Paweska""""A. Budaj""""T. Macioch""""P. Perkowski""}"
291,46028,Changes in renal blood flow measured by radionuclide angiography following exhausting exercise in humans.,eng,European journal of applied physiology and occupational physiology,Eur J Appl Physiol Occup Physiol,0301-5548,74,1,1/1/96,7-Jan,"{""S Ikawa""""M Sudoh""""M Suzuki""""S Matsubara""""M Shiota""""K Kawakami""}"
292,743129,Hormonal and dietary characteristics in obese human subjects with and without food addiction.,0,Nutrients,Jornal de pediatria,2072-6643,7,1,1/15/01,223-38,"{""Pardis Pedram""""Guang Sun""}"
293,392246,Importance of membrane materials for blood purification devices in critical care.,eng,empty,Neurosurgery,empty,40,1,1/9/02,23-31,"{""Narumi Tomisawa""""Akihiro C Yamashita""}"
294,904889,Myofascial trigger points: Spontaneous electrical activity and its consequences for pain induction and propagation,empty,empty,empty,empty,6,0,0,empty,"{""Ge H.-Y.""""Fernndez-de-las-Peas C.""""Yue S.-W.""}"
