index,id,article_title,article_language,journal_title,journal_abbreviation,journal_issn,article_jvolumn,article_jissue,article_jcreated_at,article_pagination,author_list
772,572343,High-dose sequential (HDS) chemotherapy for high-risk non-Hodgkin's lymphoma: long-term analysis and future developments.,eng,empty,The American journal of clinical nutrition,empty,80,-1,1/1/01,B123-6,"{""M Ladetto""""D Caracciolo""""G Rossi""""C Marinone""""L Bergui""""A Cuttica""""A Salomone""""M Boccadoro""""I Ricca""""C Tarella""""M Pagano""""F Zallio""""P Gavarotti""""A Pileri""""A de Crescenzo""}"
773,88262,Core symptom measures in cancer clinical trials.,eng,Journal of the National Cancer Institute,J. Natl. Cancer Inst.,1460-2105,0,7,1/14/07,empty,"{""Carolyn Gotay""}"
774,663339,Human papillomavirus infection and increased risk of HIV acquisition. A systematic review and meta-analysis.,eng,AIDS (London England),AIDS,1473-5571,26,17,11/13/12,2211-22,"{""Chunhui Wang""""Richard Hayes""""Louise Kuhn""""Stephen Shiboski""""Jennifer S Smith""""Natasha L Larke""""Deborah Watson-Jones""""Catherine F Houlihan""""Patti E Gravitt""""Karen K Smith-McCune""}"
775,718292,Prevalence of different morphologic forms of the human tongue in young Finns.,eng,Oral surgery oral medicine and oral pathology,Oral Surg. Oral Med. Oral Pathol.,0030-4220,53,2,2/1/82,152-6,"{""M Mikkonen""""R Kotilainen""""A Kullaa-Mikkonen""}"
776,245200,Osteoporosis in men,0,Arch Intern Med,Science and engineering ethics,0003-9926 (Print) 0003-9926,158,2,1/1/98,194,"{""M. Galus""}"
777,307302,Neurolymphatische Bahnen: neue wissenschaftliche Nachweise untermauern die Perrin-Technik,0,empty,empty,0,14,2,1/13/06,15-Oct,"{""Raymond N. Perrin""}"
778,217418,Long term follow-up of conservative treatment of severely traumatized maxillary incisors,English,empty,empty,0,13,4,1/1/97,190-192,"{""Z. Hirschfeld""""I. Brin""""A. Fuks""""M. Guelmann""}"
779,413717,Magnetic resonance imaging evaluation of bone marrow changes in obstructive sleep apnoea syndrome in adults,English,empty,0,empty,111,4,1/6/01,572-84,"{""A. R. Aleandri""""D. Mancini""""T. Cosentini""""R. Le Donne""""N. Colavita""}"
780,62246,Pulpal response to a fluoride-releasing all-in-one resin bonding system.,eng,Operative dentistry,Oper Dent,0361-7734,27,3,1/2/05,271-7,"{""Masayuki Otsuki""""Makoto Arakawa""""Hidekazu Sonoda""""Yasutaka Sasafuchi""""Yuichi Kitasako""""Junji Tagami""}"
781,945021,Improvement of action tremor by chronic cortical stimulation,0,Mov Disord,Movement disorders : official journal of the Movement Disorder Society,0885-3185,13,1,1/1/98,Aug-84,"{""B. Pollin""""C. Geny""""J. P. Nguyen""""P. Cesaro""""A. Feve""}"
782,649817,Validity of Rorschach Inkblot scores for discriminating psychopaths from non-psychopaths in forensic populations: a meta-analysis.,eng,Psychological assessment,Psychol Assess,1939-134X,22,2,1/10/06,336-49,"{""Scott O Lilienfeld""""Keli Holloway Allen""""Howard N Garb""""Jessica L Wildermuth""""M Teresa Nezworski""""James M Wood""}"
783,934327,Use of a Brief Phone Call After ED Discharge,0,empty,empty,empty,0,0,empty,empty,"{""NCT01893931 ""}"
784,546484,The Effects of Pre-Reading and Sharing Mechanisms on Learning with the Use of Annotations,empty,empty,EMERG RADIOL,empty,10,2,1/11/04,234-249,"{""Wu-Yuin Hwang""""Guo-Liang Hsu""}"
785,917231,[Occupational exposure to sevoflurane in pediatric operating rooms: the multi-point sampling method for risk assessment].,ita,empty,0,empty,34,3,1/12/07,266-8,"{""V Cerabona""""M Wachocka""""U Moscato""""V Camisa""""M G Tucci""""S Zaffina""""V Montaldi""""A Poscia""}"
786,887418,Impact of crizotinib on patient-reported symptoms and global quality of life (QoL) compared with chemotherapy in a phase III study of advanced alk-positive non-small cell lung cancer (NSCLC),0,empty,Biol.Blood Marrow Transplant.,0,14,1,1/13/01,-,"{""V. Hirsh""""J.Y. Han""""F. Blackhall""""S. Iyer""""D.W. Kim""""A. Shaw""""A. Reisman""""K. Wilner""""H. Nokihara""""B. Besse""}"
787,724055,A systematic review and meta-analysis of trials of treatment of depression from India,empty,empty,Interact Cardiovasc Thorac Surg,empty,56,0,1/14/01,29-38,"{""S. Sarkar""""S. Grover""}"
788,63738,[The use of ethonium paste in the treatment of deep dental caries].,rus,Stomatologiia,Stomatologiia (Mosk),0039-1735,50,2,3/1/71,79-80,"{""P K Shestakov""}"
789,422739,Reporting methods in studies developing prognostic models in cancer: a review.,0,BMC medicine,Journal of orthopaedic science : official journal of the Japanese Orthopaedic Association,1741-7015,8,0,1/10/01,20-20,"{""Patrick Royston""""Rachel Waters""""Susan Mallett""""Douglas G Altman""""Susan Dutton""}"
790,97795,Hospital discharge after ambulatory knee arthroscopy: a comparison of epidural 2-chloroprocaine versus lidocaine,empty,empty,empty,empty,26,1,1/1/01,35-40,"{""J. M. Neal""""D. J. Kopacz""""M. A. Lewis""""J. J. Deck""}"
791,155127,p16(INK4) Expression is not associated with human papillomavirus in oral lichen planus.,eng,Oral surgery oral medicine oral pathology and oral radiology,Oral Surg Oral Med Oral Pathol Oral Radiol,2212-4411,118,6,1/14/12,694-702,"{""Lucio Montebugnoli""""Luca Morandi""""Luca Scapoli""""Annalisa Palmieri""""Davide B Gissi""""Maria Pia Foschini""""Ilaria Manelli""}"
792,100986,Association of bleeding mortality and sex in acute coronary syndromes: the missing triangle.,ENG,Journal of cardiovascular medicine (Hagerstown Md.),J Cardiovasc Med (Hagerstown),1558-2035,0,-1,9/23/14,0,"{""Rossana De Palma""""Paolo Ortolani""""Caterina Caminiti""""Emilia Solinas""""Piera Angelica Merlini""""Diego Ardissino""""Giorgia Paoli""""Maria Francesca Notarangelo""""Paolo Guastaroba""""Antonio Marzocchi""""Luigi Vignali""""Roxana Mehran""""Antonio Manari""}"
793,166179,[Severe exposure to environmental lead in a child population in Antofagasta Chile],empty,empty,Adm Policy Ment Health,empty,128,2,1/1/00,221-32,"{""I. Delgado""""J. Vega""}"
794,740811,Tracheostomy Care and Complications in the Intensive Care Unit,0,empty,Biol.Blood Marrow Transplant.,0,33,5,1/13/01,18-31 14p,"{""Linda L. Morris""""Andrea Whitmer""""Erik McIntosh""}"
795,379577,Monitoring of fluid changes in hospitalized Malnourished Guatemalan children using bioelectrical impedance spectroscopy (BIS).,eng,Applied radiation and isotopes : including data instrumentation and methods for use in agriculture industry and medicine,Appl Radiat Isot,0969-8043,49,5,5/1/98,615-7,"{""C Pithan""""M Mazariegos""""N W Solomons""""P F_rst""}"
796,658981,Preliminary state of development of prediction models for primary care physical therapy: a systematic review.,eng,Journal of clinical epidemiology,J Clin Epidemiol,1878-5921,65,12,1/12/12,1257-66,"{""Martijn W Heymans""""Tobias van den Berg""""Han J R Anema""""Lieke van Oort""""Bart W Koes""""Arianne P Verhagen""""Riekie H C W de Vet""}"
797,215650,Bruxismo em crian_as Bruxism in children,empty,empty,0,empty,3,2,0,Aug-91,"{""Ronaldo Fazzi""""Ana Estela Haddad""""Maria Salete Nahs Pires Corr_a""}"
798,521132,A cadaver model to evaluate the accuracy and reproducibility of plain radiograph step and gap measurements for intra-articular fracture of the distal radius.,eng,0,The Journal of hand surgery,0363-503,29,5,1/4/09,841-7,"{""Jeff Knight""""Jeffery M Smith""""Thomas E Trumble""""Wren V McCallister""}"
799,892609,13th IEEE/ACM Symposium on Distributed Simulation and Real-Time Applications DS-RT 2009,empty,empty,empty,empty,0,1,empty,0,{NULL}
800,366275,A systematic review on the application of cardiovascular risk prediction models in pharmacoeconomics with a focus on primary prevention.,eng,European journal of preventive cardiology,Eur J Prev Cardiol,2047-4881,19,2,1/12/08,42-53,"{""Maarten J Postma""""Petros Pechlivanoglou""""Jelena Stevanovic""}"
801,513630,Pan-Canadian study of mammography screening and mortality from breast cancer.,eng,Journal of the National Cancer Institute,J. Natl. Cancer Inst.,1460-2105,106,11,1/14/11,empty,"{""Jennifer Payne""""Rukshanda Ahmad""""Gregory Doyle""""Norm Phillips""""Anna M Chiarelli""""Christine Wilson""""Kathleen Decker""""Andrew Coldman""""Bin Zhang""""Jacques Brisson""}"
802,605423,Alcohol-related morbidity and mortality.,English,empty,American journal of critical care : an official publication American Association of Critical-Care Nurses,empty,27,1,0,39-51,"{""J_rgen Rehm""""Gerhard Gmel""""Maurizio Trevisan""""Christopher T Sempos""}"
803,495319,Clinical outcome following ICD removal. The Bilitch Registry Group,eng,empty,empty,empty,16,0,1/1/93,186-192,"{""S. Furman""""D. T. Kawanishi""""S. L. Song""}"
804,733752,Eliciting relative preferences for two methods of colorectal cancer screening,0,empty,Integr. Physiol. Behav. Sci.,empty,14,2,0,124-31,"{""E. J. Frew""""J. L. Wolstenholme""""D. K. Whynes""}"
805,252118,Bilingual speech: Bilateral control?,empty,empty,0,empty,15,1,1/1/82,125-142,"{""H.M. Sussman""""P. Franklin""""T. Simon""}"
806,903817,Tiao-She nursing of traditional Chinese medicine for mild cognitive disorder: An assessment of clinical evidence,empty,empty,empty,empty,15,3,0,346-352,"{""Li X.-H.""""Li G.-C.""""Xie Y.-L.""""Shang H.-C.""""Chi K.-L.""""Jin Y.-H.""}"
807,80799,One-pot semisynthesis of exon 1 of the Huntingtin protein: new tools for elucidating the role of posttranslational modifications in the pathogenesis of Huntington's disease.,eng,Angewandte Chemie (International ed. in English),Angew. Chem. Int. Ed. Engl.,1521-3773,53,7,10/14/02,1928-33,"{""Annalisa Ansaloni""""Jae Sun Jeong""""Francesco Simone Ruggeri""""Giovanni Dietler""""Zhe-Ming Wang""""Hilal A Lashuel""}"
808,385163,Pathophysiology of paradoxical embolism: evaluation of the role of interatrial septum anatomy based on the intracardiac echocardiography assessment of patients with right-to-left shunting.,eng,0,Nutrients,1467-1107,25,1,1/15/01,47-55,"{""Gianluca Rigatelli""""Paolo Cardaioli""""Massimo Giordan""""Ashesh Buch""""Laura Oliva""""Dobrin Vassiliev""""Aravinda Nanjiundappa""""Fabio Dell'Avvocata""""Ramesh Daggubati""""Dario Adami""}"
809,645061,Impact of physical abuse on adulthood depressive symptoms among women.,eng,empty,Scand. J. Rheumatol.,empty,29,3,1/8/03,299-314,"{""Hanan Al-Modallal""""Ann Peden""""Debra Anderson""}"
810,164721,[The microclimate of apartments and its hygienic norms],empty,empty,0,empty,13,10,1/1/67,756-60,"{""M. S. Goromossow""}"
811,730721,Prediction Study of Complications After Severe Trauma,English,empty,0,empty,0,0,0,0,"{""NCT01713205 ""}"
812,439302,American Society of Clinical Oncology clinical practice guideline update on the use of pharmacologic interventions including tamoxifen raloxifene and aromatase inhibition for breast cancer risk reduction.,0,empty,empty,empty,0,0,empty,empty,{NULL}
813,410748,Preliminary validity and reliability of a Thai Berlin questionnaire in stroke patients,empty,empty,Hippokratia,empty,7,0,0,348,"{""J. Saengsuwan""""K. Sawanyawisuth""""N. Ungtrakul""""J. Saengsuwan""}"
814,133777,Spectrum and frequency of illness presenting to a pediatric emergency department.,eng,Acta clinica Belgica,Acta Clin Belg,1784-3286,61,4,1/6/07,161-5,"{""P Grard""""J Montesanti""""P Lepage""""M M Massin""}"
815,775428,Organization of ribosomes and nucleoids in escherichia coli cells during growth and in quiescence,empty,empty,Interact Cardiovasc Thorac Surg,empty,289,16,0,11342-11352,"{""K. Peisker""""B. Singh""""S. Sanyal""""Q. Chai""""X. Ge""""N. Metzendorf""""S. Dasgupta""}"
816,497593,Ventricular arrhythmias in the North American multidisciplinary study of ARVC: predictors characteristics and treatment,empty,empty,PloS one,0,22,0,0,119-125,"{""N. A. Mark Estes""""Scott McNitt""""Wojciech Zareba""""Bronislava Polonsky""""Douglas Laidlaw""""Mark S. Link""""Frank Marcus""""Kathleen Gear""}"
817,899060,Maxillofacial metastases: a retrospective review of one institution's 15-year experience,0,empty,Cytokine,empty,71,1,0,178-88,"{""R. A. Ord""""A. Salama""""R. Movahed""""S. A. McClure""}"
818,424254,Precocious and delayed sexual development in children,English,Acta Endocrinologica. Supplementum,Acta Endocrinol Suppl (Copenh),0300-9750,288,0,1/1/88,66-76,"{""B. T. Rudd""}"
819,161290,Premature androgenic alopecia and insulin resistance. Male equivalent of polycystic ovary syndrome?,empty,empty,empty,0,39,0,1/5/01,127-31 ST  - Premature androgenic alopecia and insulin resistance. Male equivalent of polycystic ovary syndrome?-,"{""L. Starka""""J. Vrbikova""""M. DA  - Dec DP  - Nlm ET  - 2006/03/24 Hill""""M. Duskova""""I. Cermakova""}"
820,746312,Pancytopenia : A rare presentation of legionella pneumonia,empty,empty,empty,empty,41,12,0,A326,"{""Cayetano K.""""Ghannam D.""""Rawat N.""}"
821,191138,Mold contamination in a controlled hospital environment: a 3-year surveillance in southern Italy,empty,empty,empty,empty,14,0,1/14/01,empty,"{""C. Coretti""""C. Napoli""""G. Lovero""""M. T. Montagna""""G. Caggiano""""G. Scarafile""""O. de Giglio""}"
822,743819,Effect of (D)-fagomine on excreted Enterobacteria and weight gain in rats fed a high-fat high-sucrose diet.,eng,Obesity (Silver Spring Md.),Tumour Biol.,1930-739X,22,4,1/14/04,976-9,"{""Eunice Molinar-Toribio""""Benjam_n Pia""""Livia G_mez""""Jara Prez-Jimnez""""Marta Casado""""Sara Ramos-Romero""""Pere Claps""""Josep Llu_s Torres""}"
823,193292,CSM2004 best platform,0,empty,empty,empty,4,0,1/4/01,10-10 ST  - CSM2004 best platform-,{NULL}
824,91852,The importance and important limitations of ultrasound imaging for evaluating thyroid nodules.,eng,JAMA internal medicine,JAMA Intern Med,2168-6114,173,19,10/28/13,1796-7,"{""David Cooper""""Erik K Alexander""}"
825,663526,Blood 25-hydroxyvitamin D concentration and hypertension: a meta-analysis.,eng,Journal of hypertension,J. Hypertens.,1473-5598,29,4,1/11/04,636-45,"{""Susanna C Larsson""""Ann Burgaz""""Alicja Wolk""""Nicola Orsini""}"
826,382853,CT features of pulmonary arterial hypertension and its major subtypes: a systematic CT evaluation of 292 patients from the ASPIRE Registry.,0,Thorax,Eur J Anaesthesiol,1468-3296,70,4,1/15/04,382-7,"{""R Condliffe""""J Hurdman""""J M Wild""""D G Kiely""""S Rajaram""""A J Swift""""C A Elliot""""C Davies""""C Hill""""I Sabroe""""C Johns""}"
827,1266,Clinical effect observation of fule cream to cure dermatitis eczemal,0,empty,Rev.Neurol.,0,24,14,1/8/01,65-68-,"{""X. H. LYWXWF Wu""}"
828,407082,A randomized controlled trial of the effects of vitamin D on muscle strength and mobility in older women with vitamin D insufficiency.,0,Journal of the American Geriatrics Society,J Am Geriatr Soc,1532-5415,58,11,1/10/11,Aug-63,"{""Amanda Devine""""Nicole Austin""""Richard L Prince""""Kun Zhu""""David Bruce""}"
829,411673,Sleep and sleep disorders in the hospital,English,empty,empty,empty,141,5,1/12/01,1337-45,"{""S. B. Venkateshiah""""N. A. Collop""}"
830,382297,Doppler-derived flow pattern in the descending aorta does not predict systemic to pulmonary arterial collateral flow in patients with single ventricle palliation: a cross-sectional study.,0,World journal for pediatric & congenital heart surgery,World J Pediatr Congenit Heart Surg,2150-136X,6,2,1/15/04,209-14,"{""Mark A Fogel""""Michael V Di Maria""""Matthew A Harris""""Meryl S Cohen""""Kevin K Whitehead""}"
831,414396,Sleep-disordered breathing associated with long-term opioid therapy,English,empty,empty,empty,123,2,1/3/01,632-9,"{""T. V. Cloward""""J. M. Walker""""S. Rhondeau""""R. J. Farney""}"
832,635082,Efficacy of allogeneic hematopoietic stem cell transplantation depends on cytogenetic risk for acute myeloid leukemia in first disease remission: a metaanalysis.,eng,empty,0,empty,103,8,4/15/05,1652-8,"{""Nobuhiko Emi""""Masamitsu Yanada""""Tomoki Naoe""""Keitaro Matsuo""}"
833,446599,[Case management for moderate-need patients and recovery: what can we learn from experimental and quasi-experimental studies?]. [Review] [French],empty,empty,empty,empty,0,1,empty,0,{NULL}
834,376525,Considerations for the diagnosis and treatment of testosterone deficiency in elderly men.,eng,The American journal of medicine,Am. J. Med.,1555-7162,120,10,1/7/10,835-40,"{""Stephen A Geraci""""Mohammed Kazi""""Christian A Koch""}"
835,637323,A comparison of early gastric and post-pyloric feeding in critically ill patients: a meta-analysis.,eng,Intensive care medicine,Intensive Care Med,0342-4642,32,5,1/6/05,639-49,"{""Kwok M Ho""""Geoffrey J Dobb""""Steven A R Webb""}"
836,153797,Definitive radiotherapy for T1 glottic squamous cell carcinoma: a 15-year Cruces University Hospital experience,0,empty,Biol.Blood Marrow Transplant.,empty,15,0,1/13/01,925-31,"{""Martinez-Indart L""""Cacicedo J""""del Hoyo""""Gomez-Iturriaga A""""Casquero F""""Lopez J L""""Bilbao P""""O ""}"
837,470179,Comparison of methods for defining prevalent vertebral deformities: the Study of Osteoporotic Fractures.,eng,Journal of bone and mineral research : the official journal of the American Society for Bone and Mineral Research,J. Bone Miner. Res.,0884-0431,10,6,6/1/95,890-902,"{""M C Nevitt""""L Palermo""""H K Genant""""R San Valentin""""D M Black""""R Epstein""""S R Cummings""}"
838,9325,Children are pharmaco-therapeutic orphans.,eng,Pediatric allergy and immunology : official publication of the European Society of Pediatric Allergy and Immunology,Pediatr Allergy Immunol,1399-3038,21,2,1/10/03,249-50,"{""C K Naspitz""""J O Warner""}"
839,294719,Prehospital hypertonic saline resuscitation attenuates the activation and promotes apoptosis of neutrophils in patients with severe traumatic brain injury.,0,Shock (Augusta Ga.),Am. J. Respir. Crit. Care Med.,1540-0514,40,5,1/13/11,366-74,"{""David B Hoyt""""Sandro B Rizoli""""Andrew J Baker""""Eileen M Bulger""""Wolfgang G Junger""""Joseph Cuschieri""""Shawn G Rhind""""Pang N Shek""}"
840,38130,Value of intravenous cholangiography prior to laparoscopic cholecystectomy,0,empty,empty,0,23,0,1/1/99,693-6; discussion 697 ST  - Value of intravenous cholangiography prior to laparoscopic cholecystectomy-,"{""S. Truong""""K. H. Treutner""""M. Jansen""""C. Schraven""""V. DA  - Jul DP  - NLM ET  - 1999/07/03 Schumpelick""""J. Neuerburg""}"
841,455697,Systematic review of occupational engagement and health outcomes among community-dwelling older adults,empty,empty,empty,0,0,1,empty,0,{NULL}
842,518335,Fractional flow reserve for guiding PCI.,eng,The New England journal of medicine,N. Engl. J. Med.,1533-4406,360,19,7/9/05,2024; author reply 2026-7,"{""Somjot S Brar""""William A Gray""}"
843,503528,Difference in postural control between patients with functional and mechanical ankle instability,0,Foot Ankle Int,PloS one,1071-1007 (Print) 1071-1007,35,10,1/14/01,1068-1074,"{""S Y Chen""""H Chen""""H Y Li""""J Zhang""""Y H Hua""}"
844,503354,Early ankle mobilization Part I: The immediate effect on acute lateral ankle sprains (a randomized clinical trial),0,empty,0,0,41,1,1/1/94,15-20,"{""J R Dettori""""B D Pearson""""C J Basmania""""W M Lednar""}"
845,176844,Importance of Arsenic and pesticides in epidemic chronic kidney disease in Sri Lanka,empty,empty,empty,empty,15,0,1/14/01,empty,"{""C. Jayasumana""""R. Gajanayake""""S. Siribaddana""}"
846,820549,Chiropractic vertebral subluxations,English,empty,0,empty,15,1,1/10/01,13-14,"{""S. Homola""}"
847,250975,Effect of infliximab on the healing of intestinal anastomosis. An experimental study in rats.,0,Int J Surg,PloS one,1743-9159,12,9,0,969-75,"{""Konstantinos Nastos""""Konstantinos Evangelou""""Marilena Papaioannou""""John Vlachogiannakos""""Maria Gazouli""""Apostolos Papalois""""Christos Zeglinas""""Ioannis Papaconstantinou""""Panagis Lykoudis""""Charalampos Tzathas""""Anneza Yiallourou""}"
848,37173,How to appraise the effectiveness of treatment,0,empty,empty,empty,27,0,1/11/01,525-531 ST  - How to appraise the effectiveness of treatment-,"{""Suzanne B. Stewart""""Phillip Dahm""""D DB  - rzh DO  - 10.4103/0970-1591.91446 DP  - EBSCOhost""}"
849,641251,Non-steroidal anti-inflammatory drugs and myocardial infarctions: comparative systematic review of evidence from observational studies and randomised controlled trials.,eng,Ann Reum Dis,Am. J. Med.,Mar-67,66,10,1/7/10,1296-304,"{""E H Choy""""D L Scott""""P A Scott""""G H Kingsley""""C M Smith""}"
850,302179,Using a social communication intervention to improve the social interactions and employment experiences of adolescents with high functioning autism spectrum disorders,empty,empty,0,empty,0,0,0,3224,"{""Beth Anne Clavenna-Deane""}"
851,627882,Is there evidence that barrier membranes prevent bone resorption in autologous bone grafts during the healing period? A systematic review.,eng,empty,0,empty,22,3,1/7/05,390-8,"{""Ruud R M Bos""""Gerry M Raghoebar""""Pepijn F M Gielkens""""Boudewijn Stegenga""}"
852,264151,Recognizing naming and measuring a family intensive care unit syndrome,empty,empty,empty,0,12,3,1/14/01,435-441,"{""D. R. Sullivan""""G. Netzer""}"
853,711975,Association of diet exercise and smoking modification with risk of early cardiovascular events after acute coronary syndromes.,empty,Circulation,Circulation,22-Sep,121,6,2/16/10,750-758 9p,"{""Yusuf S""""Fox KA""""Chow CK""""Anand SS""""Jolly S""""Rao-Melacini P""}"
854,12554,Retrovirus-mediated WASP gene transfer corrects Wiskott-Aldrich syndrome T-cell dysfunction.,eng,Human gene therapy,Hum. Gene Ther.,1043-0342,13,9,10/2/06,1039-46,"{""G Jayashree Jagadeesh""""David L Nelson""""Taizo Wada""""Fabio Candotti""}"
855,564924,Complication rate of endosonography (endobronchial and endoscopic ultrasound): a systematic review.,0,Respiration; international review of thoracic diseases,PloS one,1423-0356,87,4,0,343-51,"{""A van Breda""""M B von Bartheld""""J T Annema""}"
856,364080,Comparison of serum and renal gentamicin concentrations with fractional urinary excretion tests as indicators of nephrotoxicity,0,empty,empty,0,11,4,1/1/88,330-7,"{""S. A. Brown""""F. B. Garry""}"
857,727134,The Antiseptic Efficacy and Tolerability of Lavasept 0.04% on Acute Traumatic Wounds,English,empty,Expert Opin Emerg Drugs,0,0,0,1/10/01,0,"{""NCT01153620 ""}"
858,356635,Determinants of arterial wall remodeling during lipid-lowering therapy: serial intravascular ultrasound observations from the Reversal of Atherosclerosis with Aggressive Lipid Lowering Therapy (REVERSAL) trial,0,Circulation,Circulation,22-Sep,113,24,1/6/01,2826-34,"{""S. Lin""""S. E. Nissen""""K. Wolski""""I. Sipahi""""E. M. Tuzcu""""S. J. Nicholls""""T. Churchill""""P. Schoenhagen""""T. Crowe""""C. Wang""""A. Loyd""""C. Apperson-Hansen""""W. A. Magyar""}"
859,272721,Economic evaluation of inhaled nitric oxide in preterm infants undergoing mechanical ventilation,0,empty,Obesity (Silver Spring),empty,124,5,1/9/01,1325-1332,"{""A. M. Hibbs""""D. M. Black""""J. A. F. Zupancic""""A. Cnaan""""P. L. Ballard""""S. R. Wadlinger""""L. Palermo""""W. E. Truog""""R. A. Ballard""}"
860,979725,The impact of emotional and social support on the quality of life depression and disability among us adults with chronic obstructive pulmonary disorder (COPD): A propensity score analysis,0,empty,0,0,26,3,0,A176,"{""R. Arabyat""""D. W. Raisch""}"
861,470615,Can we improve the follow up of asthmatic patients with asthma educational program (PAMA)? [Abstract],0,empty,0,0,44,0,1/14/01,P3021,"{""Francitorra ME""""Sanchez GS""""Manrique CA""""Velasco TT""""Castany A R""""Escriche XF""""Fernndez CS""""Fornell LL""""lvarez S""""Fernndez EA""""Rodriguez MVF""""Sim_ MR""""Mayo EP""}"
862,71351,Differential dendritic cell-mediated activation and functions of invariant NKT-cell subsets in oral cancer.,ENG,Oral diseases,Oral Dis,1601-0825,0,-1,3/22/14,0,"{""Nk Shukla""""Sn Das""""P Gaur""""Ak Singh""}"
863,793299,[Use of probiotics and prebiotics in infant formulas].,spa,empty,0,empty,31,-1,0,Jul-72,"{""Venancio Mart_nez Surez""}"
864,673560,[Postacute care].,spa,empty,0,empty,143,1,7/14/07,29-33,"{""Margarita Admetlla Falgueras""""Josep Fust Sugraes""}"
865,258181,Internet-delivered exposure and mindfulness based therapy for irritable bowel syndrome--a randomized controlled trial,empty,empty,empty,0,122,6,1/10/01,531-9,"{""Perjohan Lindfors""""Liselotte Jansson""""Brjann Ljotsson""""Lisa Falk""""Erik Hedman""""Christian Ruck""""Amanda Wibron Vesterlund""""Sergej Andreewitch""""Nils Lindefors""""Gerhard Andersson""""Timo Hursti""}"
866,11709,Sleep-related nighttime crying (yonaki) in Japan: a community-based study.,eng,Pediatrics,Pediatrics,1098-4275,115,1,1/5/01,217-24,"{""Michio Fukumizu""""Marie J Hayes""""Makiko Kaga""""Jun Kohyama""}"
867,603381,WITHDRAWN: Zinc for the common cold.,eng,empty,Rheumatology (Oxford England),empty,-1,3,0,CD001364,"{""I Marshall""}"
868,570263,Successful treatment with a rituximab-based regimen of a splenic marginal zone lymphoma with villous lymphocytes in a very frail patient on maintenance dialysis.,eng,Cancer chemotherapy and pharmacology,Cancer Chemother. Pharmacol.,1432z-0843,63,4,1/9/03,759-60,"{""Andrea Tendas""""Paolo de Fabritiis""""Marco Giovannini""""Daniela Piccioni""""Roberto Palumbo""""Alessio Pio Perrotti""""Luca Cupelli""""Teresa Dentamaro""""Laura Scaramucci""""Pasquale Niscola""}"
869,395807,In this issue,0,empty,Expert Opin Emerg Drugs,0,107,7,1/10/01,empty,{NULL}
870,149836,Exercise-induced changes of the upper extremity in chronic stroke survivors,empty,empty,empty,empty,15,0,0,58-68 ST  - Exercise-induced changes of the upper extremity in chronic stroke survivors-,"{""P. Kluding""""S. A. DA  - Winter DO  - 10.1310/let5-xnby-98q6-q8tg DP  - NLM ET  - 2005/03/01 Billinger""}"
871,813023,Respiratory syncytial virus prophylaxis: cost-effective analysis in Argentina (Structured abstract),0,empty,Bioelectromagnetics,0,24,3,1/2/01,287-291,"{""G. Bauer""""E. Laffaire""""L. Bouzas""""C. Gilli""""L. Novali""""S. P. Rodriguez""""D. Farina""""H. Gonzalez""}"
